{
  "$schema": "../../../v1/core/structure_metrics.schema.json",
  "schema_version": "1.0",
  "structure_score": {
    "value": 0.234,
    "ci95": [0.201, 0.267],
    "status": "validated"
  },
  "entanglement_error_correlation": {
    "value": 0.456,
    "ci95": [0.423, 0.489],
    "status": "validated"
  },
  "concentration_index": {
    "value": 0.321,
    "ci95": [0.295, 0.347],
    "status": "validated"
  },
  "total_correlation": {
    "value": 1.567,
    "ci95": [1.434, 1.700],
    "status": "validated"
  }
}